{
  "@context": [
    "https://www.w3.org/ns/credentials/v2",
    "https://raw.githubusercontent.com/nfh-trust-labs/opencred-vc-schemas/main/schemas/insurance-policy/v1/context.jsonld"
  ],
  "id": "urn:uuid:00000000-0000-4000-8000-000000000001",
  "type": [
    "VerifiableCredential",
    "InsurancePolicyCredential"
  ],
  "issuer": {
    "id": "did:web:issuer.example",
    "name": "Example Issuer"
  },
  "validFrom": "2026-04-08T00:00:00Z",
  "credentialSubject": {
    "id": "did:example:subject",
    "policyNumber": "POL-2026-0098765",
    "policyType": "vehicle",
    "policyHolder": {
      "name": "Alice Johnson",
      "dateOfBirth": "1988-02-20"
    },
    "insurer": {
      "name": "Global Insurance Ltd",
      "legalEntityIdentifier": "529900T8BM49AURSDO55"
    },
    "validFrom": "2026-04-01T00:00:00Z",
    "validUntil": "2027-03-31T23:59:59Z",
    "coverage": [
      {
        "hazard": "Collision",
        "sumInsured": {
          "currency": "USD",
          "value": 50000
        },
        "deductible": {
          "currency": "USD",
          "value": 500
        }
      },
      {
        "hazard": "Third-party liability",
        "sumInsured": {
          "currency": "USD",
          "value": 1000000
        }
      }
    ],
    "premium": {
      "amount": {
        "currency": "USD",
        "value": 1200
      },
      "frequency": "annual"
    },
    "insuredItem": {
      "type": "vehicle",
      "vin": "1HGBH41JXMN109186",
      "make": "Honda",
      "model": "Civic"
    }
  }
}
